{
  "$schema": "https://json-schema.org/draft/2020-12/schema",
  "$id": "https://github.com/tz-stack-registry/schema.json",
  "title": "Tanzanian Company Tech Stack",
  "description": "Schema for a stack.json entry describing the technical stack of a Tanzanian company.",
  "type": "object",
  "required": [
    "company_name",
    "industry",
    "frontend",
    "backend",
    "database",
    "cloud_infra",
    "mobile_tech"
  ],
  "additionalProperties": false,
  "properties": {
    "company_name": {
      "type": "string",
      "minLength": 1,
      "description": "Official name of the company."
    },
    "industry": {
      "type": "string",
      "enum": ["fintech", "agritech", "logistics", "saas"],
      "description": "Sector the company operates in. Must match the parent folder under /sectors."
    },
    "frontend": {
      "type": "array",
      "items": { "type": "string", "minLength": 1 },
      "description": "Frontend technologies (frameworks, libraries, languages). Use an empty array if not applicable."
    },
    "backend": {
      "type": "array",
      "items": { "type": "string", "minLength": 1 },
      "description": "Backend languages and frameworks."
    },
    "database": {
      "type": "array",
      "items": { "type": "string", "minLength": 1 },
      "description": "Databases and data stores (SQL, NoSQL, cache, search)."
    },
    "cloud_infra": {
      "type": "array",
      "items": { "type": "string", "minLength": 1 },
      "description": "Cloud providers, orchestration, and infrastructure tooling."
    },
    "mobile_tech": {
      "type": "array",
      "items": { "type": "string", "minLength": 1 },
      "description": "Mobile technologies. Use an empty array if the company has no mobile product."
    },
    "sources": {
      "type": "array",
      "minItems": 1,
      "items": {
        "type": "object",
        "required": ["type", "url"],
        "additionalProperties": false,
        "properties": {
          "type": {
            "type": "string",
            "enum": ["job_post", "careers_page", "about_us_page", "linkedin", "social_media", "engineering_blog", "conference_talk", "employee_testimony", "github"]
          },
          "url": { "type": "string", "format": "uri" },
          "note": { "type": "string" }
        }
      },
      "description": "Proof of stack. Required for all entries submitted to the registry."
    },
    "last_verified": {
      "type": "string",
      "format": "date",
      "description": "ISO-8601 date (YYYY-MM-DD) when the entry was last confirmed."
    }
  }
}
