{
  "company_name": "CRDB Bank",
  "industry": "fintech",
  "frontend": [],
  "backend": [],
  "database": [],
  "cloud_infra": [],
  "mobile_tech": [],
  "sources": [
    {
      "type": "careers_page",
      "url": "https://careers.crdbbank.co.tz/jobs",
      "note": "Official careers portal. Tech arrays pending confirmation from individual job posts."
    },
    {
      "type": "about_us_page",
      "url": "https://crdbbank.co.tz/en/about-us",
      "note": "Corporate about page — verification of company identity."
    },
    {
      "type": "linkedin",
      "url": "https://tz.linkedin.com/company/crdbbank",
      "note": "Official LinkedIn company page."
    }
  ],
  "last_verified": "2026-05-18"
}
